{
  "schema_version": "2",
  "assessment_id": "AndrewMaged814/safelane-demo#42@75bc4b013dae587dc301e6065a04c78a7e29a7ee:2026.08.3",
  "assessed_at": "2026-08-09T12:01:00Z",
  "policy_version": "2026.08.3",
  "assessment_input_sha256": "sha256:0a394a553e667c59ad32950af96e568bb7c0a33618d4895552669f9bcff37fe5",
  "assessment_result_sha256": "sha256:17aae475e54a1676f14aabb9199843915c7091834020a37e08d219c25d9c299a",
  "change": {
    "repository": "AndrewMaged814/safelane-demo",
    "pull_request": 42,
    "base_sha": "f43738b1fe17f55ff127fd5555bd4211e58c5797",
    "head_sha": "75bc4b013dae587dc301e6065a04c78a7e29a7ee",
    "files_changed": 1,
    "lines_changed": 3,
    "services": ["demo-api"],
    "all_paths_recognized": true
  },
  "evidence": {
    "git_diff_sha256": "sha256:4b404c65211c8feb13303fc8f39187daaf33948f6e8dbec5d7bc7b41832b1eb3",
    "ai_status": "complete",
    "ai_model_digest": "sha256:1b887ea9fcc509e2b623100d65066db75f6b93500ad2e2e8ab9e0ffc1d18e055",
    "prompt_sha256": "sha256:8d113786ae59af97d88657698bfa762f3f10c0f0654e8ab1b528524415935f99",
    "response_schema_sha256": "sha256:f8026eb41dbdf29390967e608b4819420679000922c8c3b5f70266c99769836e",
    "incident_history": "disabled_by_policy"
  },
  "ai_findings": [
    {
      "id": "finding-001",
      "kind": "breaking_api",
      "spans": [
        {"file": "src/demo_api/app.py", "side": "removed", "line": 17, "text": "@app.get(\"/v1/quote\")"},
        {"file": "src/demo_api/app.py", "side": "added", "line": 18, "text": "@app.get(\"/v2/quote\")"}
      ],
      "source_reference_verified": true
    }
  ],
  "selected_safeguard": {
    "finding_ref": "finding-001",
    "selection_source": "ai_safeguard",
    "hypothesis_kind": "removed_http_route_unavailable",
    "hypothesis": "Existing callers of GET /v1/quote may receive a non-success response.",
    "verification_intent_kind": "preserve_removed_http_route",
    "probe_id": "demo-api-public-quote-v1",
    "catalog_entry_sha256": "sha256:9609894ce89aba5029ac9a5b67b69229d07e4d29bb6f771f9efd9e4c61264074",
    "probe_preview": {
      "method": "GET",
      "path": "/v1/quote",
      "expected_status": 200,
      "attempts": 3,
      "interval_seconds": 10,
      "failure_allowance": 1,
      "request_timeout_seconds": 2,
      "active_deadline_seconds": 45,
      "canary_only": true
    },
    "approval_question_kind": "confirm_callers_migrated",
    "approval_question": "Have all callers migrated away from GET /v1/quote?",
    "remediation_kind": "retain_removed_route_as_alias",
    "remediation": "Retain GET /v1/quote as an alias while introducing GET /v2/quote, then reassess."
  },
  "policy_trace": {
    "baseline": {
      "rule_id": "scope.low",
      "tier": "safe",
      "reason": "The change affects at most 2 recognized files and 50 changed lines."
    },
    "safety_floors": [
      {
        "rule_id": "finding.breaking_api",
        "minimum_tier": "risky",
        "reason": "An existing HTTP contract was removed or renamed."
      }
    ]
  },
  "policy_result": {
    "final_tier": "risky",
    "minimum_profile": "Strict",
    "evidence_confidence": "high",
    "fast_eligible": false,
    "primary_reason": "An existing HTTP contract was removed or renamed."
  },
  "rollout_options": [
    {
      "name": "Strict",
      "source": "built_in",
      "traffic_router": "none",
      "replicas": 5,
      "max_surge": 1,
      "max_unavailable": 0,
      "stages": [
        {"set_weight": 20, "exposure_pods": 1, "analysis": true},
        {"set_weight": 40, "exposure_pods": 2, "analysis": true},
        {"set_weight": 60, "exposure_pods": 3, "analysis": true},
        {"set_weight": 100, "exposure_pods": 5, "analysis": false}
      ]
    }
  ],
  "review": {"status": "unresolved", "resolution": null}
}
